{
  "schemaVersion": 1,
  "id": "fixture-scene",
  "units": "m",
  "materials": [
    {
      "id": "mat-brick",
      "name": "Brick",
      "bandsHz": [125, 250, 500, 1000, 2000, 4000],
      "absorption": [0.1, 0.1, 0.12, 0.15, 0.15, 0.2],
      "scattering": 0.1
    },
    {
      "id": "mat-plaster",
      "name": "Plaster",
      "bandsHz": [125, 250, 500, 1000, 2000, 4000],
      "absorption": [0.05, 0.05, 0.06, 0.07, 0.08, 0.1],
      "scattering": 0.05
    },
    {
      "id": "mat-glass",
      "name": "Glass",
      "bandsHz": [125, 250, 500, 1000, 2000, 4000],
      "absorption": [0.03, 0.03, 0.03, 0.04, 0.04, 0.05],
      "scattering": 0.02
    }
  ],
  "entities": [
    {
      "type": "wall",
      "id": "wall-north",
      "name": "North",
      "start": [0, 0, 0],
      "end": [6, 0, 0],
      "height": 2.8,
      "thickness": 0.2,
      "faces": { "inner": "mat-brick", "outer": "mat-glass", "side": "mat-plaster" },
      "openings": [
        { "type": "door", "offset": 1.0, "width": 0.9, "height": 2.1, "sill": 0 }
      ]
    },
    {
      "type": "void",
      "id": "void-window",
      "name": "Window",
      "origin": [3.5, -0.2, 1.0],
      "size": [1.0, 0.2, 0.8]
    },
    {
      "type": "solid_box",
      "id": "block-1",
      "name": "Block",
      "origin": [1, 0, 1],
      "size": [0.5, 1.2, 0.5],
      "materialId": "mat-brick"
    }
  ],
  "sources": [],
  "receivers": [],
  "meshSettings": {
    "surface": { "algorithm": "earclip", "quality": "standard" },
    "volume": { "algorithm": "hex-box", "targetSize": 0.15, "enabled": false }
  }
}
